to_keep	game	platforms	editor	developer	gender	Source explication	Source nom	Source lien	Autre source	Autre source	type	Multijoueur	Date de sortie	Annoncé en
0 (nouveau support ok)	Fortnite (coming to Switch)	PC, Xbox One, PS4, iOS	Epic Games	Epic Games / People Can Fly	Multi (choix + personnalisation)	"On compte ainsi sur le skin Chef de l'équipe rose (pour l'avatar féminin), et Peinture de Guerre (pour l'avatar masculin). Ils sont tous les deux légendaires. "	IGN	https://fr.ign.com/fortnite-pc/39315/news/fortnite-un-skin-pour-les-fondateurs-et-les-defis-anniversai?utm_source=recirc	https://www.forbes.com/sites/erikkain/2018/12/06/here-are-all-the-new-season-7-battle-pass-skins-in-fortnite-battle-royale/#255251967a22	https://www.bfmtv.com/tech/fortnite-supprime-le-mouvement-de-poitrine-d-un-personnage-feminin-1532907.html	survie / action / battle royale	yes	25/07/2017	
1	Forza Horizon 4	Xbox One, PC	Microsoft Studios	Playground Games	Multi (choix + personnalisation)	Les femmes représentent la moitié des personnages jouables.	Youtube Forza Horizon 4 Character Customization (PC HD)	https://www.youtube.com/watch?v=046TGFxiLWI	https://www.youtube.com/watch?v=3QeVmcKvjg8	https://www.windowscentral.com/forza-horizon-4	sport / course / automobile	yes	02/10/2018	
0 (nouveau support ok)	Freedom Planet (coming to Switch)	PC, PS4, Switch												
1	Fringe Wars	PS4, Xbox One, PC	Oasis Games	OASIS GAMES / Thinking Stars	N/a	"Fringe Wars is a team-based multi-player space game that puts you in direct command of massive capital starships and propels you into tactical warfare."	Steam	https://store.steampowered.com/app/799650/Fringe_Wars/	https://fwen.oasgames.com	https://www.releases.com/p/fringe-wars	Massivement multijoueur / Action / Science-fiction / jeu de tir	yes	2019 (actuellement en version alpha)	
1	Gal Metal †	Nintendo Switch	DMM Games	DMM Games	M	"One night while on his way home from school, a high school boy is abducted by the Octoids, an extraterrestrial species bent on revenge. The boy's soul is transplanted into a high school girl's body in a sinister experiment. Now sharing a body, the duo must work together with her high school band, K.M.G. (Kichijoji Metal Girls) to defeat the aliens with their greatest weakness: metal!"	Nintendo	https://www.nintendo.com/games/detail/gal-metal-switch	https://www.actugaming.net/test-gal-metal-drum-173264/	http://www.nintendolife.com/reviews/nintendo-switch/gal_metal	Musique	yes	02/11/2018 (en France, dévoilé au Tokyo Game Show en 2017)	
1	Galak-Z: Variant S †	Nintendo Switch	GungHo Online Entertainment	17-BIT	M	"n Galak-Z: Variant S, players trek across the universe as A-Tak, the last surviving human pilot, who is fighting to take the universe back from the evil Baron’s Imperial forces."	Nintendo Everything	https://nintendoeverything.com/galak-z-variant-s-out-for-switch-on-june-28/	https://www.playstation.com/fr-be/games/galak-z-ps4/	https://www.youtube.com/watch?v=TaKsKO-8uis	Shoot'em up / action / space / rpg / rogue-like	no	28/06/2018	
1	Gears 5	Xbox One, PC	Microsoft Studios	The Coalition	F	Centré sur le personnage de Kait (which may allow players to sometimes take the role of supporting male characters, so long as they clearly focus on a female character as the primary protagonist.)	Feminist Frequency	https://feministfrequency.com/2018/06/14/gender-breakdown-of-games-featured-at-e3-2018/	https://comicbook.com/gaming/2018/06/10/gears-of-war-5-female-woman-reactions/	https://www.ign.com/articles/2018/06/21/gears-5-definitely-wont-be-called-gears-of-war-5	jeu de tir à la troisième personne / action		Fin 2019	
0 (pas assez d'info)	Gears Pop!	iOS	Microsoft	The Coalition	M					https://www.youtube.com/watch?v=J-DhTGCLbiY			2019	2018
0 (pas assez d'info)	Gears Tactics	Xbox One, PC	Xbox Game Studios	The Coalition						https://www.youtube.com/watch?v=JR5eedO5P-Q	stratégie / tour par tour		2019	2018
1	Generation Zero	Xbox One, PC, PS4	THQ Nordic	Avalanche Studios	Multi (personnalisation)	Trailer de démonstration, où il est possible de choisir le genre du personnage	Combat and Character Customizaton - Generation Zero Closed Beta (Youtube)	https://www.youtube.com/watch?v=82-xxwS-RFo	https://www.gameinformer.com/index.php/preview/2018/08/17/get-a-look-at-the-impressive-open-world-and-gameplay	https://generationzero.com/en	action / survie	yes	26/03/2019	
1	Ghost of Tsushima	PS4	Sony Interactive Entertainment	Sucker Punch Productions	M	"Le joueur incarnera Jin Sakai, un ronin ayant décidé d’adopter la voie du Fantôme pendant la période de guerre qui secoue le Japon. Son parcours ne sera pas de tout repos, et il devra fréquemment dégainer son sabre…"	Plugin	https://plugin.01net.com/tech/e3-2018-ghost-of-tsushima-la-nouvelle-claque-des-createurs-d-infamous-1471116.html	https://gamergen.com/actualites/e3-2018-ghost-of-tsushima-du-gameplay-excitant-presente-039-est-epoustouflant-292573-1	https://www.millenium.org/news/301663.html	action / aventure / infiltration		Non dévoilée	
1	Ghost Giant †	PS4 VR	Zoink	Zoink	Gender-ambiguous	"Avec ce premier titre spécialement conçu pour la réalité virtuelle, le studio de Stick it to the Man, Fe et Flipping Death propose un mélange d'aventure et de réflexion dans lequel le joueur incarne un fantôme géant que seul le jeune Louis est capable de voir"	Gamekult	https://www.gamekult.com/actualite/zoink-sortira-ghost-giant-le-16-avril-sur-ps-vr-3050814389.html	https://www.noobfeed.com/news/6551/ghost-giant-for-playstation-vr-announced-by-fe-developer	https://www.youtube.com/watch?v=hEJnJz43e10	aventure / Énigme / Famille / battle royale / puzzle	no	16/04/2019	
1	The Golf Club 2019 †	Xbox One, PS4, PC	HB Studios	HB Studios	Multi (choix + personnalisation)	"You start the game by creating your golfer. You have an extensive list of customizable options including gender, facial features, body dimensions, hairstyle and so forth"	GameSpace	https://www.gamespace.com/reviews/the-golf-club-2019-review/	https://www.youtube.com/watch?v=aBZqTyz6BSE	https://www.youtube.com/watch?v=O_j9nQOcCU8	sport	yes	28/08/2019	
1	GreedFall †	PC, Xbox One, PS4	Focus Home Interactive	Spiders	Multi (choix + personnalisation)	"At the beginning of the game, you pick your gender"	Site officiel de GreedFall	http://greedfall.com/	http://checkpointgaming.net/news/2017/08/same-sex-romances-confirmed-greedfall/	https://www.gameinformer.com/index.php/preview/2018/06/13/political-intrigue-and-supernatural-beasts-collide-in-greedfall	rpg / action / fantastique	no	2019	
1	Gungrave VR †	PS4 VR	Marvelous	Iggymob	M	" Vous incarnez Grave, un soldat mort-vivant réveillé de son sommeil de nouveau afin de combattre des Orgmen, c’est-à-dire des humains infectés par une drogue nommée SEED. "	ActuGaming	https://www.actugaming.net/test-gungrave-vr-181626/	https://store.steampowered.com/app/892210/GUNGRAVE_VR/	https://www.youtube.com/watch?v=8JbiVnspwEE	Action / Beat'em All / tir / FPS et TPS 	no	14/12/2017  (au Japon, 07/12/2018 en France	
0 (no info)	Halo Infinite	Xbox One, PC	Xbox Game Studios	343 Industries										
1	Harold Halibut	PC, PS4, Xbox One, Switch	Curve Digitql	Slow Bros.	M	"Enfilant la tenue d'un homme d'entretien au sein d'une communauté vivant dans la carcasse d'un vaisseau spatial des années 70 pris au piège sous les eaux d'une lointaine planète-océan, le joueur accompagnera Harold dans sa routine quotidienne, qui inclut l'assistance du professeur Jeanne Mareaux, l'une des scientifiques du groupe dont le but est de trouver un moyen de redémarrer le vaisseau."	Gamekult	https://www.gamekult.com/actualite/harold-halibut-le-technicien-bonne-pate-3050796841.html	https://www.senscritique.com/jeuvideo/Harold_Halibut/32054745	https://www.gamesidestory.com/2018/09/24/harold-halibut/	narratif / puzzle / aventure / exploration	no	2019	2017
1	Heavy Fire: Red Shadow	PS4, PSVR, Xbox One, PC	Mastiff	Mastiff	M	"Dans Heavy Fire: Red Shadow, les joueurs rentrent dans les bottes de de combat du Sergent Will, qui a survécu de justesse à une attaque par missile nord-coréenne sur Guam, visant à défaire ses défenses, se trouve maintenant presque seul à tenter de repousser un raid nord-coréen à grande échelle."	Xbox world	http://xbox-world.fr/heavy-fire-red-shadow-disponible/	https://www.youtube.com/watch?v=lJPaGZNRNa8	https://store.steampowered.com/app/664840/Heavy_Fire_Red_Shadow/	tir / première personne / fps / action / militaire / arcade / on rails	no	16/10/2018	
1	Hitman 2	PS4, Xbox One, PC	Warner Bros. Interactive	Io Interactive	M	"Si l'habit change, le moine, lui, reste le même : il sera toujours question pour notre assassin dégarni de voyager aux quatre coins du globe pour éliminer des cibles présentées par la voix très britannique de Diana Burnwood. "	GameKult	https://www.gamekult.com/jeux/hitman-2-3050878739/test.html	https://steamcommunity.com/app/863550/discussions/0/1694923613874913447/	https://www.jeuxactu.com/test-hitman-2-l-efficacite-avant-l-originalite-une-suite-a-la-hauteur-115969.htm	infiltration /action	yes	13/11/2018	
1	Home Sweet Home	PC, Xbox One, PS4	Yggdrazil Group	Yggdrazil Group	M	"L'histoire du jeu nous met dans la peau de Tim qui bien que déjà assez déboussolé par la disparition inexpliquée de sa femme va en plus se réveiller dans un endroit inconnu en lieu et place de son domicile. Sa priorité devient alors d'échapper des esprits étrangement rancuniers, notamment celui d'une femme pour le moins contrariée."	GameKult	https://www.gamekult.com/actualite/le-jeu-d-horreur-thailandais-home-sweet-home-va-sortir-sur-ps4-et-xbox-one-3050809713.html	https://store.steampowered.com/app/617160/Home_Sweet_Home/	http://www.jeuxvideo.com/test/755452/home-sweet-home-l-horreur-conventionnelle.htm	horreur / à la première personne	no	27/09/2017	
1	Insurgency: Sandstorm †	Xbox One, PS4, PC	Focus Home Interactive	New World Interactive	Multi (choix)	"Both sides of a fight sound like they could include multinational forces, and there are female avatars, albeit only on the side of security. That makes the game feel, at the very least, like an equal opportunity offender."	Polygon.com	https://www.polygon.com/2018/12/12/18137821/insurgency-sandstorm-multiplayer-horde-impressions	https://screenrant.com/insurgency-game-free-steam-insurgency-sandstorm/	https://venturebeat.com/2018/12/10/the-real-conflicts-and-soldiers-that-inspired-insurgency-sandstorm/	tir / FPS	yes	31/12/2019	
1	Islands of Nyne: Battle Royale	Xbox One, PC, PS4	Define Human Studios	Define Human Studios	M	Le personnage est masculin.	Shrouds Fast & Flawless Victory On Islands of Nyne Battle Royale (Youtube)	https://www.youtube.com/watch?v=x6idm8N17Go	https://www.youtube.com/watch?v=XmMGD_2gJFE	https://www.gamekult.com/actualite/define-human-annule-subitement-islands-of-nyne-et-met-la-cle-sous-la-porte-3050812443.html	fps / tir / science-fiction / action / battle royale / survie	yes	12/07/2018	
1	Just Cause 4	PS4, Xbox One, PC	Square Enix	Avalanche Studios	M	"Trois ans après ses mésaventures sur son île natale de Medici, Rico Rodriguez est de retour dans un quatrième épisode qui nous emmène cette fois-ci sur Solis, une nouvelle île des Caraïbes oppressée par un régime totalitaire"	Jeuxactu.com	https://www.jeuxactu.com/test-just-cause-4-plaisir-instantane-mais-grande-frustration-116427.htm	https://twinfinite.net/2018/12/just-cause-4-character-appearance-change/	https://www.numerama.com/pop-culture/446287-test-de-just-cause-4-un-defouloir-sans-saveur.html	action / aventure /  GTA-like	no	04/12/2018	
1	Just Dance 2019	PS4, Xbox One, Switch	Ubisoft	Ubisoft	Multi (choix)	Trailer de démonstration	Just Dance 2019 (Youtube)	https://www.youtube.com/watch?v=74-yp1hp5NY	https://www.youtube.com/watch?v=74-yp1hp5NY	https://www.youtube.com/watch?v=lrd8R74oXdM	musique / danse	yes	23/10/2018	
1	Jump Force †	PS4, Xbox One, PC	Bandai Namco Entertainment	Spike Chunsoft	Multi (choix)	"Namely, this is an opportunity to briefly reflect and consider how there appears to be very few female characters available as playable options in the game."	Metro	https://metro.co.uk/2019/01/04/where-are-all-the-women-in-jump-force-readers-feature-8274972/	https://www.breakflip.com/fr/jump-force/guide/jump-force-liste-des-personnages-jouables-du-jeu-de-combat-8079	https://www.polygon.com/2019/2/15/18226323/jump-force-playable-female-characters	combat	yes	14/02/2019 (au Japon)	
1	Killer Queen Black †	Nintendo Switch	Liquid Bit	Liquid Bit	gender-ambiguous	Il n'est pas possible d'associer de façon claire un genre aux personnages visibles dans les trailers de démonstration.	Killer Queen Black - Announcement Trailer - Nintendo E3 2018 (Youtube)	https://www.youtube.com/watch?v=2K0B8wsIoY8	https://www.youtube.com/watch?v=zwgOvGK3Ebo	https://www.actugaming.net/killer-queen-black-sortie-repoussee-a-lete-prochain-190030/	jeu de plateforme / stratégie / action	yes	2019	2018
0 (2017)	Kingdom Hearts 3 †	PS4, Xbox One	Square Enix	Square Enix	Multi (au long de la partie)	Les personnages jouables sont masculin, même si sur une courte partie du jeu il est possible de jouer Aqua.	Télérama	https://www.telerama.fr/enfants/jeux-video-pour-enfants-kingdom-hearts-iii,-final-dune-saga-de-jeux-de-role-fleuve,n6131671.php	https://twinfinite.net/2019/01/kingdom-hearts-3-all-playable-characters/	https://www.crossmap.com/news/kingdom-hearts-3-release-date-co-director-says-that-aquas-story-in-the-kingdom-hearts-2-8-final-chapter-prologue-is-important.html	action / rpg	no	25/01/2019 (au Japon)	
1	Kingdom: Two Crowns	Switch, Xbox One, PC	 Raw Fury	Noio, Coatsink	Multi (choix)	"he Monarch is the playable character in the Kingdom series. The monarch runs the kingdom by traversing it upon their mount, and organizing the work of their subjects,  The king wears a crown and a coloured cape while the queen wears a tiara and coloured dress. By pressing the "s" or "down" button (or by tapping the screen in the mobile version) during the loading screen, gender, skin colour, and the colour of the cape or dress will be randomised, letting the player decide on their preference. Once selected, players cannot change their character unless they start a new game." 	Fandom	https://kingdomthegame.fandom.com/wiki/Monarch	https://www.youtube.com/watch?v=2xwaYvuP9Jg	https://www.millenium.org/news/321000.html	stratégie / aventure / gestion	yes (coopt)	11/12/2018	
1	The Last of Us Part II	PS4	Sony Computer Entertainment	Naughty Dog	F	"Il y a quelques semaines, nous apprenions qu'Ellie serait le seul personnage jouable de ce deuxième épisode. Mais, les développeurs veulent éclaircir un point puisque même si ce sera le cas, elle ne sera pas seule face à l'adversité."	GameWave	https://gamewave.fr/the-last-of-us-part-ii/the-last-of-us-part-2-ellie-ne-sera-pas-seule-face-au-danger/	https://www.usgamer.net/articles/ellie-will-be-the-only-playable-character-in-the-last-of-us-part-2	https://www.polygon.com/e3/2018/6/14/17464810/the-last-of-us-2-e3-2018-trailer-ellie-joel-playable	action / aventure / à la troisième personne	yes	2019	03/12/2016
1	LEGO DC Supervillains	PC, Xbox One, PS4, Switch	WB Games	Traveller's Tales	Multi (choix + personnalisation)	De nombreux personnages sont jouables, dont plusieurs femmes.	LEGO DC SUPER-VILAINS - Tous les Personnages !	https://www.youtube.com/watch?v=SkV3aFzkmcc	https://www.lego.com/fr-fr/games/videogames/lego-dc-super-villains-beb50ae024bc4d59973b83a62b5ffbfa	https://www.youtube.com/watch?v=_otgUKHfUC8	action / aventure	yes (coopt)	17/10/2018	
1	Little Dragons Cafe	Nintendo Switch, PS4	Rising Star Games	Aksys Games	Multi (choix)	"You can’t edit how this character looks like, meaning you can’t change their facial features, height, and overall physical appearance. It’s also worth noting that once you pick the male or female protagonist, you can’t switch to the other twin in Little Dragons Cafe."	Twinfinite	https://twinfinite.net/2018/08/little-dragons-cafe-character-customization/	https://little-dragons-cafe.fandom.com/wiki/Little_Dragons_Caf%C3%A9_Wiki	https://gematsu.com/2018/05/little-dragons-cafe-details-prologue-story-characters-and-adventure	aventure / rpg / simulation	no	20/09/2018	
1	Madden NFL 19	PS4, Xbox One, PC	EA Sports	EA Sports	M	Dans les étapes de création du personnage, il est impossible de créer une joueuse.	Madden NFL 19 - Customize | Create Player (HD) (Youtube)	https://www.youtube.com/watch?v=vVZjWW7z9ao	https://www.polygon.com/e3/2018/6/9/17444644/madden-nfl-19-longshot-chapter-two-preview-ea-sports	https://bleacherreport.com/articles/2788256-madden-nfl-19-release-date-and-latest-info-on-longshot-story-mode	sport	yes	10/08/2018	
1	Maneater	PC	Tripwire Interactive	Blindside Interactive	N/a	Le joueur ou la joueuse incarne un requin.	Jeuxvideo.com	http://www.jeuxvideo.com/news/861024/e3-2018-maneater-montre-ses-crocs.htm	https://gamewave.fr/maneater/maneater-sera-lance-en-exclusivite-sur-le-epic-game-store/	https://store.steampowered.com/app/629820/Maneater/?l=french	RPG / action / aventure / sous-marin / monde ouvert / gore	no	Unknown	
0 (DLC)	Mario + Rabbids DLC	Nintendo Switch												
1	Mario Tennis Aces †	Nintendo Switch	Nintendo	Camelot Software Planning	Multi (choix)	Peach ou encore Daisy font partie des personnages jouables, à l'instar d'autres personnages masculins.	NIntendo	https://www.nintendo.fr/Jeux/Nintendo-Switch/Mario-Tennis-Aces-1325791.html	https://www.polygon.com/2018/6/5/17430576/mario-tennis-aces-characters-ranked	https://www.youtube.com/watch?v=3FfLn3chd0U	sport	yes	22/06/2018	
0 (no info)	Mavericks: Proving Grounds	PC	Automaton Games Ltd.	Automaton	Multi (choix)						battle royale / massivement multijoueur / combat	yes	21/2/2019 (accès anticipé, nombreux retards)	
1	Mega Man 11 †	Nintendo Switch, PC, Xbox One, PS4	Capcom	Capcom	M	"Mega Man was almost "super masculine"" / "There's no female Robot Master this time around"	US Gamer	https://www.usgamer.net/articles/four-difficulty-settings-and-no-female-robot-masters-11-things-we-know-about-mega-man-11	https://www.gamekult.com/actualite/capcom-annonce-mega-man-11-3050800539.html	https://nintendalerts.com/test-mega-man-11-sur-nintendo-switch/	action / plate-forme	no	02/10/2018	
1	Megalith †	PS4 VR	Disruptive Games	Disruptive Games	Multi (choix + personnalisation)	On peut jouer le personnage d'Aurora.	GameBlog	http://www.gameblog.fr/blogs/vrsinge/p_131432_megalith-la-video-de-gameplay-complete-vr-le-futur	https://www.gamekult.com/actualite/megalith-le-hero-shooter-du-ps-vr-lance-sa-beta-ouverte-3050811263.html	https://www.vrplayer.fr/playstation-vr-megalith-test/	fps /shooter / action	yes	08/01/2019	
0 (remake)	Metal Wolf Chaos XD	PC, Xbox One, PS4												
0 (2017)	Metro Exodus	PC, Xbox One, PS4	Deep Silver	4A Games	M	"Artyom, le protagoniste de la série Metro, quitte les souterrains de Moscou avec d'autres membres de l'Ordre pour explorer l'est de la Russie en quête d'une nouvelle vie."	Jeuxvideos.com	http://www.jeuxvideo.com/jeux/jeu-669725/#details	https://www.metrothegame.com/fr/lhistoire-de-metro/	https://www.numerama.com/pop-culture/410385-on-a-joue-a-metro-exodus-a-la-gamescom-une-premiere-impression-mitigee.html	fps / Post-apocalyptique / combat /  infiltration / exploration / survival horror	no	15/02/2019	
0 (nouveau support ok)	Monster Hunter Generations Ultimate †	Nintendo Switch	Funcom	The Bearded Ladies Consulting							tactique / rpg / tour par tour	no		
1	Mutant Year Zero: Road to Eden †	PC, Xbox One, PS4	Funcom	The Bearded Ladies Consulting	n/a	" Le joueur peuvent contrôler une équipe de héros mutants : Dux, un canard avec une arbalète, Bormin un sanglier en colère et Selma"	Jeuxvideos.com	http://www.jeuxvideo.com/jeux/jeu-804326/	http://www.gameblog.fr/tests/3245-mutant-year-zero-road-to-eden-pc	https://www.actugaming.net/test-mutant-year-zero-road-to-eden-un-x-com-like-reussi-178526/	tactique / rpg / tour par tour	no	04/12/2018	
1	My Friend Pedro	PC, Switch	Devolver Digital	DeadToast	M	"Mon ami Pedro est un ballet violent axé sur l’amitié, l’imagination et le combat d’un homme pour éliminer tous ceux qui se trouvent sur son passage, à la demande d’une banane sensible."	Indiemag	https://www.indiemag.fr/jeux/my-friend-pedro	https://switchfan.org/jeux/my-friend-pedro-annonce-e3-2018/	https://www.youtube.com/watch?v=WYh3ilP0ZTA	action / shoot 'em up  / ActionBeat'em all	no	2019	
1	My Hero Ones Justice †	PC, PS4, Xbox One, Switch	Byking	Bandai Namco Entertainment	Multi (choix + personnalisation)	"Les personnages connus pour être surpuissants donnent vraiment l'impression d'être des rouleaux compresseurs ; ceux censés être rapides se déplacent effectivement à la vitesse du son ; même les personnages comme Ochaco et Tsuyu, connus pour leurs aptitudes de combat limitées, possèdent des mouvements qui leur permettent de tenir tête à des combattants qui n'en feraient qu'une bouchée dans l'anime"	IGN	https://fr.ign.com/my-hero-academia-ones-justice-ps4/42540/review/test-my-hero-ones-justice	https://www.jeuxactu.com/my-hero-academia-one-s-justice-les-images-de-shoto-tenya-et-ochaco-112761.htm	https://www.youtube.com/watch?v=wvN8tFr3Fg0	combat / superhéros / mangas	yes	23/08/2018	
1	Naruto to Boruto: Shinobi Strikers	PS4, PC, Xbox One	BANDAI NAMCO Entertainment.	Soleil Ltd.	Multi (choix + personnalisation)	"Players begin their adventure with a simple yet intuitive character creation suite ranging; gender, background, cosmetic facial differences, height and physical appearance of your avatar. "	Xbox Tavern	https://www.xboxtavern.com/naruto-to-boruto-shinobi-striker-review/	https://www.youtube.com/watch?v=V2SviN_iIao	https://www.youtube.com/watch?v=-13v3BYyDcs	fight / 	yes	30/08/2018	2017
1	NBA Live 19	PC, Xbox One, PS4, Switch	EA Sports	EA Sports	Multi (choix + personnalisation)	"With GameFaceHD, dozens of preset heads, hundreds of hairstyles, and access to all of the Playstyles, female players with truly be able to express their custom look in NBA LIVE 19."	EA.com	https://www.ea.com/games/nba-live/nba-live-19/news/female-create-a-player	https://www.youtube.com/watch?v=0FtSJJM9hmg	https://www.businessinsider.fr/us/nba-live-19-mixed-gender-wnba-2018-9	Sport	yes	07/09/2018	
0 (nouveau support ok)	Nier Automata	PS4, Xbox One, PC	Square Enix	PlatinumGames										
1	Nioh 2	PS4, Xbox One, PC	Koei Tecmo Holdings	Team Ninja	Multi (choix + personnalisation)	"Le premier élément clé est que Nioh 2 permettra au joueur de concevoir son propre protagoniste, y compris le sexe et la couleur de peau, par opposition au personnage imposé de William Adams dans le premier épisode. Pouvoir créer son propre héros était selon Team Ninja une requête récurrente de la part des joueurs du premier épisode. "	Gamekult	https://www.gamekult.com/actualite/koei-tecmo-devoile-quelques-details-sur-nioh-2-3050806409.html	https://segmentnext.com/2018/06/13/nioh-2-character-customization/	https://gematsu.com/2018/06/nioh-2-has-character-customization-protagonist-possesses-the-power-of-yokai	action / rpg	yes	2019	2018
1	Ninjala †	Switch	GungHo Online Entertainment	GungHo Online Entertainment	Multi (choix)	L'un des personnages disponibles est féminin.	4 Minutes of Ninjala for Nintendo Switch - Off-Screen - E3 2018 (Youtube)	https://www.youtube.com/watch?v=8f2nTlEPBwg	https://www.youtube.com/watch?v=oaMIjpgmVXk	https://www.youtube.com/watch?v=CoWJFWyljBQ	action / battle royale	yes	2019	2018
1	Necromunda: Underhive Wars	PC, PS4, Xbox One	Rogue Factor	Focus Home Interactive	Multi (choix + personnalisation)	"La personnalisation semble faire l’objet d’une attention toute particulière, puisque la joueuse du clan Escher pouvait décider des protections portées par chaque guerrière de son gang, membre par membre, ici une épaulette en métal, là un protège-tibia rembourré..."	Gamekult	https://www.gamekult.com/jeux/necromunda-underhive-wars-3050840875/test.html	https://www.youtube.com/watch?v=0eaqdOb9H2U&vl=fr	http://www.rpgfrance.com/dossier-10565-1-preview-necromunda-underhive-wars	rpg / tactique / tour par tour	yes	2019	
1	Octopath Traveler	Nintendo Switch	Nintendo	Square Enix, Acquire	Multi (choix)	"Vous débutez votre périple en incarnant l'un des huit voyageurs aux origines, aux talents et aux objectifs différents. " (La moitié sont des femmes)	Nintendo	https://www.nintendo.fr/Jeux/Nintendo-Switch/OCTOPATH-TRAVELER-1275922.html#Vue_d_ensemble	http://www.jeuxvideo.com/wikis-soluce-astuces/593702/wiki-de-octopath-traveller.htm	https://www.gamekult.com/jeux/project-octopath-traveler-3050838175/test.html	rpg / J-RPG / aventure	no	13/07/2018	
0 (2017)	Ooblets	Xbox One, PC	Double Fine Productions	Glumberland	Multi (personnalisation)	Le personnage est customisable selon les goûts du joueur - il peut être tant masculin que féminin.	"Rebecca Cordingley and Ooblets -- Highlighting Women in Video Games Ep. 1"	https://www.youtube.com/watch?v=GRSNNivQK1g	https://www.youtube.com/watch?v=EeRuBoO-HmE	https://www.youtube.com/watch?v=IREOjTUWD8s	simulation / agricole	no	2019	
0 (2017)	Ori and the Will of the Wisps	Xbox One, PC	Microsoft Studios	Moon Studios	N/a	Le personnage est non-humain.	Ori and the Will of the Wisps - E3 2018 - Gameplay Trailer (Youtube)	https://www.youtube.com/watch?v=kd0zbNw1VOg	https://www.youtube.com/watch?v=kUUU1zgmVF8	https://www.youtube.com/watch?v=rcvgrJxEDT4	plates-formes / aventure / Metroidvania / action	yes	2019	2017
