to_keep	game	platforms	editor	developer	gender	Source explication	Source nom	Source lien	Autre source	Autre source	type	Multijoueur	Date de sortie	Annoncé en
1	Outer Wilds 	Xbox One, PC	Annapurna Interactive	Mobius Digital	gender-ambiguous	"A travers les yeux d'un héros créé de toutes pièces (genre, apparence, caractéristiques, aptitudes plus ou moins rigolotes), The Outer Worlds vous refera le coup de l'Etranger. "	Gamekult	https://www.gamekult.com/jeux/the-outer-worlds-3050879967/test.html	https://www.fig.co/campaigns/outer-wilds/updates/831		exploration / espace /  extra-terrestre / science-fiction / aventure / action	no	2019	
1	Overcooked 2 †	Switch, TBA	Team17	Team17, Ghost Town Games	Multi (choix)	Tous les personnages ne sont pas humains, mais parmi ceux qui le sont on compte plusieurs femmes.	Nintendo	https://www.nintendo.fr/Jeux/Nintendo-Switch/Overcooked-2-1388792.html	https://www.gamepur.com/guide/36284-overcooked-2-chefs-guide.html	http://www.jeuxvideo.com/wikis-soluce-astuces/908617/debloquer-tous-les-chefs.htm	simulation / cuisine	yes	07/08/2018	
1	Overkill's The Walking Dead †	Xbox One, PC, PS4	Starbreeze Studios, 505 Games	Overkill Software	Multi (choix)	La moitié des quatre personnages jouables sont des femmes.	Twitter (OVERKILL's The Walking Dead)	https://twitter.com/overkillstwd/status/984015814947983361?lang=fr	https://www.youtube.com/watch?v=-0J8we7aa-A	http://www.jeuxvideo.com/wikis-soluce-astuces/955142/choisir-et-connaitre-son-personnage.htm	FPS / horreur / survie	yes	06/11/2018	2014
1	Persona 3: Dancing in Moonlight †	PS4, PS Vita	Sega	Atlus	Multi	Il y a des danseurs féminins ou masculins.	The First 16 Minutes of Persona 3: Dancing in Moonlight (Youtube)	https://www.youtube.com/watch?v=eT5o-YnsLmI	https://www.youtube.com/watch?v=SaguWO9xMtM	http://www.gameblog.fr/tests/3076-persona-3-dancing-moon-night-ps4-psv	musique / rythme / danse	no	24/05/2018 (au Japon)	
1	Persona 5: Dancing in Starlight †	PS4, PS Vita	Sega	Atlus	Multi	"les développeurs ont justement supprimé le choix du danseur principal pour pouvoir les peaufiner."	Sega mag	https://www.psthc.fr/jeu-ps4_vita/persona5-dancing-starlight-ps4-psvita/test-jeu.htm	https://eu.rgj.com/story/life/2018/12/04/p-5-d-persona-5-dancing-starlight-guide-technobubble/2196963002/	https://www.youtube.com/watch?v=-PwoLvZBQdk	musique / rythme / danse	no	24/05/2018 (au Japon)	
1	Planet Alpha	PC, PS4, Xbox One, Switch	Team17	Planet Alpha ApS	M	". On y incarne un homme qui se réveille sur une étrange planète qui abrite une faune et une flore mystérieuses. Les joueurs devront alors explorer cette nouvelle contrée tout en utilisant la capacité spéciale du personnage principal, qui peut contrôler le cycle jour/nuit de la planète, afin de controuner les dangers qui se dressent devant eux."	Jeux Actu	https://www.jeuxactu.com/planet-alpha-un-premier-trailer-de-gameplay-seduisant-113057.htm	https://www.indiemag.fr/news/planet-alpha-puzzle-platformer-planete-surprenante-annonce-date-sortie	https://www.youtube.com/watch?v=WMJ_iI_ui2U	plates-formes / réflexion / extra-terrestres	no	04/09/2018	
0 (2017)	Player Unknown's Battlegrounds	PC, Xbox One	 PUBG Corporation (Bluehole)	 PUBG Corporation (Bluehole)	Multi (choix + personnalisation)	Il est possible de choisir une femme et de la personnaliser.	PlayerUnknown's Battleground - Character Creator: Male, Female, Face Presets, Hair & Skin Tones	https://www.youtube.com/watch?v=qsR9c5hOUo0	https://www.youtube.com/watch?v=CcAZOWndSCk	https://www.youtube.com/watch?v=Prx0uqVlHX0	Action / Aventure / MMO / MMOFPS / Shooter / Battle Royale	yes	23/03/2017	
1	Paladins: Realm Royale †	PC, PS4, Switch	Hi-Rez Studios	Heroic Leap Games	Multi (choix, niveau)	"All female Champions of the Realm will be unlocked."	Site officiel de Paladins	https://www.paladins.com/news/international-womens-day-march-8-2019	https://www.gamereactor.eu/images/?textid=726153&id=2720193&sid=d0dae0a3794acb29eabcec0bbcf2bf24	https://www.youtube.com/watch?v=6BIUCHKPvgM	fantasy / battle royale / fps / survie / coopération / pvp / monde ouvert	yes	05/06/2018 (version open bêta)	
0 (2017)	Pokemon: Let's Go, Pikachu/Eevee †	Nintendo Switch	Nintendo	Game Freak	Multi (choix)	Il est possible d'incarner une héroine ou un héros.	Site officiel de Pokémon	https://pokemonletsgo.pokemon.com/fr-fr/story/	https://www.pokekalos.fr/jeux/switch/pokemonletsgopikachuevoli/articles-artwork-des-personnages-562.html	https://pokemonletsgo.pokemon.com/fr-fr/story/	aventure / rpg	yes	16/11/2018	
0 (extension)	Prey: Mooncrash (extension)	PC, Xbox One, PS4	Bethesda Softworks	Arkane Studios									11/06/2018	
0 (DLC)	Prey: Typhon Hunter (dlc)	VR												
0 (2016)	Quake Champions †	PC	Bethesda Softworks	id Software, Saber Interactive	Multi (choix + personnalisation)	Plusieurs personnages de genre différent sont disponibles.	PC Games	https://www.pcgamesn.com/quake-champions/quake-champions-characters-abilities	https://kentuckynerd.com/whats-the-best-champion-in-quake-champions/	http://n4g.com/news/2029647/quake-champions-female-character-nyx-highlighted-in-new-trailer	FPS / Tir /  Gore / Action / Science-fiction / Horreur / Lovecraftien	yes	22/08/2017	2016 (E3)
1	The Quiet Man	PC, PS4	Square Enix	Square Enix, Human Head Studios	M	"Ce projet choral tente de narrer l'histoire de Dane, un protagoniste sourd, en plaçant sa surdité au centre de la narration. "	Jeuxvideo.com	http://www.jeuxvideo.com/test/950825/the-quiet-man-la-defaillance-d-une-aventure-cinematographique.htm	https://www.gamekult.com/jeux/the-quiet-man-3050878803.html	https://thequietman.fandom.com/wiki/The_Quiet_Man_(character)	action / aventure	no	01/11/2018	2018
1	Rainbow Six Siege †	PC, PS4, Xbox One	Ubisoft	Ubisoft Montréal, Ubisoft Toronto	Multi (choix)	Plusieurs personnages de genre différent sont disponibles.	Site officiel d'Ubisoft	https://rainbow6.ubisoft.com/siege/fr-fr/game-info/operators.aspx	https://www.youtube.com/watch?v=qhIoBSVya_A	https://www.youtube.com/watch?v=o-xYL3-k_FQ	tir / tactique	yes	01/12/2015	
1	Rage 2	PS4, Xbox One, PC	Bethesda Softworks	Avalanche Studios, id Software	M	"In #RAGE2, you are Walker. You're not Nicholas Raine -- the guy from the first game. So, what happened to him? No really, I'm asking, I have no idea."	Twitter officiel de RAGE2	https://twitter.com/RAGEgame/status/999334146613825538?ref_src=twsrc%5Etfw%7Ctwcamp%5Etweetembed%7Ctwterm%5E999334146613825538&ref_url=https%3A%2F%2Fwww.jeuxvideo-live.com%2Fnews%2Frage-2-le-retour-dun-personnage-et-le-pilotage-de-veehicules-annoncees-89570	https://www.jeuxvideo-live.com/news/rage-2-le-retour-dun-personnage-et-le-pilotage-de-veehicules-annoncees-89570	http://www.allocine.fr/article/fichearticle_gen_carticle=18673019.html	FPS  / monde ouvert / post-apocalyptique / futur / tir	no	14/05/2019	
1	Raji: An Ancient Epic	PS4, Xbox One, PC, Switch	Nodding Heads Games	Nodding Heads Games	F	"Raji: An Ancient Epic is set in ancient India, where a young girl sets out to rescue her brother from demons – winning the favour of the gods as humanity’s champion in the process"	PC Games	https://www.pcgamesn.com/raji-an-ancient-epic/raji-an-ancient-epic-art-style	https://www.youtube.com/watch?v=9qKxXNOljmE	https://store.steampowered.com/app/730390/Raji_An_Ancient_Epic/	Action / aventure	no	2020	2015
1	Rapture Rejects	PC	tinyBuild	Galvanic Games, Explosm Games	Multi (personnalisation)	"Rather than opting to use gender options in the character creator for Rapture Rejects, Galvanic Games and Explosm Games instead added two checkboxes, one for “boobs” and one for “dong.” On the surface, it’s a little crude. But for non-binary and transgender people like myself, a small change like this can go a long way. "	Gamer Evolution	https://www.gamerevolution.com/news/400793-rapture-rejects-gender-neutral-character-creator	https://www.youtube.com/watch?v=pxDnoszjBko	https://www.youtube.com/watch?v=_OGdywonGBE	battle royale / funny 	yes	29/11/2018	
1	Rend	PC	Frostkeep Studios	Frostkeep Studios	Multi (choix + personnalisation)	On peut choisir le genre du personnage et le personnaliser (couleur de peau, pilosité)	REND - PRE EARLY ACCESS - CHARACTER CREATION (Youtube)	https://www.youtube.com/watch?v=r97y5ygzQW4	https://www.youtube.com/watch?v=1y6ipalGdi8	https://www.youtube.com/watch?v=i41rbb39GoE	Survie / Monde ouvert / Aventure / Fabrication	yes	31/07/2018	
0 (remake)	Resident Evil 2 Remake †	PS4, Xbox One												
1	Roller Coaster Tycoon Switch	Nintendo Switch	Atari	Nvizzio Creations	N/a	Il s'agit d'un jeu de gestion (parc d'attractions) où l'on incarne pas un personnage en particulier.	Nintendo	https://nintendalerts.com/test-rollercoaster-tycoon-adventures-sur-nintendo-switch/	http://www.nintendolife.com/reviews/nintendo-switch/rollercoaster_tycoon_adventures	https://www.nintendo.fr/Jeux/Nintendo-Switch/RollerCoaster-Tycoon-Adventures-1477540.html	gestion / simulation	unknown	29/11/2018	
1	Sable	PC, Xbox One	Raw Fury	Shedworks	F	"You start [Sable] with your family and you then leave home. The ending is just 'she decides to go home' and you send her home, and just kind of end it. You maybe didn't see everything there is to see, you maybe didn't see all of the world, but you saw what you were interested in and hopefully that's a cool story for you"	Eurogamer	https://www.eurogamer.net/articles/2019-01-25-unmasking-sable-character-identity-and-storytelling-in-a-sci-fi-desert	https://store.steampowered.com/app/757310/Sable/	https://www.dropbox.com/s/0u9y6mbdliq2cxt/Sable%20Press%20Kit%202018.zip?dl=0&file_subpath=%2FSable+Press+Kit+2018	aventure / exploration	no	2019	
0 (2017)	Sakuna: Of Rice and Ruin †	PS4, PC	Xseed Games	Edelweiss	F	"A l’origine, Sakuna est une petite déesse de l’agriculture, mais l’irruption de créatures malfaisantes sur l’île d’Hinoe l’oblige à justifier sa réputation de bêcheuse. Ce sera en effet l’arme de prédilection de l’héroïne, qui la manie comme personne"	Gamekult	https://www.gamekult.com/jeux/sakuna-of-rice-and-ruin-3050876003/test.html	http://www.jeuxvideo.com/news/665133/e3-2017-sakuna-sera-sur-le-stand-xseed.htm	https://www.youtube.com/watch?v=C6aC2tZjajA	Action / Plate-Forme / combat	unknown	2019	
0 (no info)	Satisfactory	PC	Coffee Stain Studios	Coffee Stain Publishing							simulation / première personne / exploration / monde ouvert / fps	yes	19/03/2019	
1	Sea of Solitude	TBA	Electronic Arts	Jo-Mei Games	F	Sea of Solitude, a beautiful game about a woman turned into a monster, revealed at EA Play	PC Gamer	https://www.pcgamer.com/sea-of-solitude-a-beautiful-game-a-woman-turned-into-a-monster-revealed-at-ea-play/	https://www.okbeast.com/2018/06/10/sea-of-solitude-could-change-how-women-are-portrayed-in-games/	https://www.youtube.com/watch?v=aWY76dNvXyo	aventure / exploration	no	2019	
0 (dlc)	Sea of Thieves: Cursed Sails and the Forsaken Shores	Xbox One, PC												
1	Sekiro: Shadows Die Twice	PS4, Xbox One, PC	Activision	FromSoftware	M	" It won’t have character creation or a vast array of weapons, armor and spells. "	Polygon	https://www.polygon.com/2018/10/2/17925002/sekiro-shadows-die-twice-tgs-2018-hidetaka-miyazaki-interview	https://www.polygon.com/2018/10/2/17925002/sekiro-shadows-die-twice-tgs-2018-hidetaka-miyazaki-interview	https://www.onlysp.com/sekiro-shadows-die-twice-has-no-character-creator-soul-currency-or-rpg-systems/	action / aventure / rpg	no	23/03/2019	
0 (remake)	Senran Kagura Burst Re:Newal †	PS4	Marvelous	Tamsoft, Honey ∞ Parade Games	F	Les personnages, tres stereotypes, sont uniquement feminins.	Gamekult	https://www.gamekult.com/actualite/senran-kagura-burst-re-newal-sera-lance-dans-un-mois-en-europe-3050812371.html	http://freakingeek.com/senran-kagura-burst-renewal-confirme-en-europe/	https://store.steampowered.com/app/889510/SENRAN_KAGURA_Burst_ReNewal/	action / hack and slash / beat-'em-up	no	22/02/2018	
1	Serious Sam 4: Planet Badass	PC	Devolver Digital	Croteam	M	Le joueur incarne Sam, un homme.	Site officiel de Serious Sam	http://www.serioussam.com/	https://www.youtube.com/watch?v=wlAUNjjnH_4	https://store.steampowered.com/app/257420/Serious_Sam_4_Planet_Badass/	survie / monde ouvert / aventure / tir / fps / coopération / gore	yes	unknown	
1	Session	Xbox One, PC	Crea-ture Studios	Crea-ture Studios	M	A verifier : le personnage apparent dans tous les extraits / demo est un homme.	Session Live Stream - New Skate Game From Creature Studios (Youtube)	https://www.youtube.com/watch?v=oEkFp2vmXXU	https://www.youtube.com/watch?v=BvvNg3hcwy0		sport / skate	no	2019	2018
1	SCUM	PC	Devolver Digital	 Gamepires, Croteam	Multi (choix + personnalisation)	On peut choisir le genre du personnage.	Site officiel de SCUM	https://scumgame.com/en/news/character-creation-customization-pre-alpha	https://www.youtube.com/watch?v=pEtFq7jZ7kI	https://twitter.com/ScumGame/status/1040578263368773632	survie / monde ouvert / zombies / action / aventure / fps / troisieme personne / gore / rpg	yes	29/08/2018	2016
1	Shadow of the Tomb Raider †	PC, PS4, Xbox One	Square Enix	Crystal Dynamics, Eidos Montréal	F	Le joueur incarne Lara Croft.	Steam	https://store.steampowered.com/app/750920/Shadow_of_the_Tomb_Raider/	https://tombraider.square-enix-games.com/fr	https://www.gamekult.com/jeux/tomb-raider-2-suite-du-reboot-3050877545/test.html	action / aventure / troisieme personne / monde ouvert / survie / tir / exploration	yes	14/09/2018	2018
0 (remake)	Shining Resonance Refrain †	Nintendo Switch, PS4, Xbox One, PC												
1	The Sinking City †	PS4, Xbox One, PC	Bigben Interactive	Frogwares	M	"En l’occurrence, notre héros était chargé de venir en aide à une bibliothécaire qui se trouve avoir la bouche cousue. La jeune femme affirme avoir été menacée par une personne dont elle ne veut pourtant rien dire à l’enquêteur, la règle manifeste régissant la ville semblant être « gardez votre bouche fermée ou nous la fermerons pour vous ». Ainsi, notre pauvre victime a sans doute dû un peu trop parler de choses qui devraient être tues. "	Jeuxvidéos.com	http://www.jeuxvideo.com/preview/906833/the-sinking-city-une-enquete-prometteuse-au-coeur-d-un-univers-lovecraftien-gamescom-2018.htm	https://www.thesinkingcity.com/en	https://store.steampowered.com/app/750130/The_Sinking_City/	action / investigation / Gore / Lovecraftian / Detective / Thriller / monde ouvert / horreur	no	27/06/2019	
0 (2017)	Skull and Bones †	PS4, Xbox One, PC	Ubisoft	Ubisoft Singapour, Blue Byte, Ubisoft Chengdu	Multi (choix)	"E3 2017: Ubisoft Announces Skull and Bones, Features Female Pirates"	JStation X	http://jstationx.com/2017/06/13/e3-2017-ubisoft-skull-and-bones-female-pirates/	https://skullandbones.ubisoft.com/game/en-us/news/detail.aspx?news=327054&title=everythingyouneedtoknowaboutskull&bonesaftere32018	https://www.youtube.com/watch?v=hjC8_av7hhU	action / aventure	yes	2019	2017
1	Soulcalibur VI	PS4, Xbox One, PC	Bandai Namco	Bandai Namco	Multi (choix + personnalisation)	On peut choisir le genre de son personnage.	Soul Calibur 6 Create Character Mode Female (Youtube)	https://www.youtube.com/watch?v=4ggnRkZW_9w	https://www.youtube.com/watch?v=QxPf8BhJNlQ	http://www.jeuxvideo.com/jeux/jeu-761811/#details	Action / Combat / fantastique		19/10/2018	
1	Space Hulk Tactics †	PC, Xbox One, PS4	Focus Home Interactive	Cyanide Studio	M	On joue un camp (composé d'hommes). A vérifier	Jeuxvidéos.com	http://www.jeuxvideo.com/test/939306/space-hulk-tactics-une-adaptation-efficace-manquant-d-audace.htm	http://www.gameblog.fr/tests/3191-space-hulk-tactics-pc	http://spacehulk-tactics.com/	stratégie / tour par tour / tactique	yes	9/10/2018	
0 (2016)	Spider-Man †	PS4	Sony Interactive Entertainment	Insomniac Games	M (principal)	Le personnage principal est masculin, même si on peut aussi incarner à un moment un personnage féminin.	Gamekult	https://www.gamekult.com/jeux/spider-man-ps4-3050715199/test.html	https://www.eclypsia.com/fr/spider-man/actualites/spider-man-les-ennemis-la-taille-de-la-map-et-les-personnages-jouables-25978	https://www.jeuxvideo-live.com/news/spider-man-passe-ea-laction-pour-le3-2018-89792	action / aventure	no	07/09/2018	
1	Spintires: MudRunner †	Xbox One, PS4, PC, Nintendo Switch	Focus Home Interactive	Saber Interactive	M	Le conducteur est masculin	[FR] Spintires MUDRUNNER gameplay - ép 1 - Présentation et 2 défis de la simulation de tous-terrains (Youtube)	https://www.youtube.com/watch?v=yvTqxVgKQYo	https://www.youtube.com/watch?v=gIKtz4OmbJ4	https://steamcommunity.com/app/675010/discussions/0/1694922345928505585/?l=romanian	course	yes	31/12/2017	
1	Spyro Reignited Trilogy †	PS4, Xbox One	Activision Blizzard	Toys for Bob	N/a	Le joueur incarne un dragon.	Site officiel de Spyro The Dragon	https://www.spyrothedragon.com/fr/	https://www.youtube.com/watch?v=orzNU1R4wb8	https://www.youtube.com/watch?v=yYwoGG1-YwE	plates-formes	no	13/11/2018	
0 (no info)	Starfield	TBA												
0 (2017)	Starlink: Battle for Atlas †	PS4, Xbox One, Nintendo Switch	Ubisoft	Ubisoft Toronto, Virtuos	Multi (choix)	Un personnage masculin est disponible, de même qu'un personnage féminin et des non-humains.	Site officiel d'Ubisoft	https://starlink.ubisoft.com/game/fr-fr/starlink/pilots	https://www.nintendo.fr/Jeux/Nintendo-Switch/Starlink-Battle-for-Atlas-1388917.html	https://venturebeat.com/2018/08/25/starlink-battle-for-atlas-hands-on-preview-on-my-mission-to-save-toys-to-life/	action / aventure	yes	16/10/2018	
0 (2016)	Star Wars: Jedi Fallen Order	TBA	Electronic Arts	Respawn Entertainment	M			https://fr.ign.com/star-wars-jedi-fallen-order-ps4/45413/news/star-wars-jedi-fallen-order-sera-devoile-a-la-star-wars-cele	https://gaming.gentside.com/star-wars/star-wars-jedi-fallen-order-pc-ps4-xbox-one-date-de-sortie-trailers-news-et-gameplay-du-nouveau-jeu-star-wars_art25717.html	http://www.fredzone.org/star-wars-jedi-fallen-order-attendu-fin-2019-887	action / aventure / tir / troisième personne	no	2019	
1	State of Mind	PS4, Xbox One, PC, Nintendo Switch	Daedalic Entertainment	Daedalic Entertainment	M (principal)	"L'action prend place à Berlin en 2048, où le protagoniste Richard Nolan tente de survivre avec sa famille."	Jeuxvideos.com	http://www.jeuxvideo.com/jeux/pc/jeu-508000/	https://invisioncommunity.co.uk/state-of-mind-review/	https://www.gamereactor.eu/reviews/686003/State+of+Mind/	aventure / narratif / science-fiction / futur	yes	15/08/2018	2016
0 (2017)	Strange Brigade	Xbox One, PS4, PC	Rebellion Developments	Rebellion Developments	Multi (choix)	" Rompus aux méthodes de lutte contre les entités surnaturelles, ces quatre hommes et femmes au caractère bien trempé interviennent partout où se produisent des phénomènes inexplicables, avec toute latitude pour y mettre un terme."	Gamekult	https://www.gamekult.com/publicite/strange-brigade-le-gameplay-3050808495.html	https://www.express.co.uk/entertainment/gaming/1009605/Strange-Brigade-review-PS4-Xbox-One-Rebellion	https://www.youtube.com/watch?v=GiolfCFEL9A	TPS / tir / action / troisième personne / horreur / zombies / tir 	yes	28/08/2018	
1	Street Fighter V: Arcade Edition †	PS4, PC	Capcom	Capcom	Multi (choix + personnalisation)	Personnages féminins et masculins disponibles.	Street Fighter V: Arcade Edition - Holiday Costumes 2018 (Youtube)	https://www.youtube.com/watch?v=l0pUppRM4iA	https://gamergen.com/actualites/street-fighter-arcade-edition-des-costumes-mega-man-red-earth-et-plus-encore-venir-dlc-299848-1	https://streetfighter.com/?lang=fr	combat / arcade / action	yes	16/01/2018	
1	Super Smash Bros. Ultimate	Nintendo Switch	Nintendo	Sora Ltd., Bandai Namco	Multi (choix)	Personnages de l'univers Mario (F/M/na)	Site officiel de Smashbros	https://www.smashbros.com/fr_FR/	https://www.nintendo.fr/Jeux/Nintendo-Switch/Super-Smash-Bros-Ultimate-1395713.html	https://www.gamekult.com/jeux/super-smash-bros-3050878075.html	combat / plates-formes	yes	07/12/2018	
1	Super Mario Party	Nintendo Switch	Nintendo	Nd Cube	Multi (choix)	"Vous avez le choix entre 20 personnages jouables du monde de Mario, qui possèdent chacun un dé particulier !"	Site officiel de Nintendo	https://www.nintendo.fr/Jeux/Nintendo-Switch/Super-Mario-Party-1388641.html	https://www.youtube.com/watch?v=JUHgJdjV0Ls	https://www.youtube.com/watch?v=by_XTria-mQ	fête / coopératif	yes	05/10/2018	
1	Super Meat Boy Forever	Nintendo Switch, Xbox One, PC, PS4	Team Meat	Team Meat	Multi	"Both Meat Boy and Bandage Girl are playable characters who run automatically while dodging obstacles that are set before them."	DVS Gaming	https://www.dvsgaming.org/super-meat-boy-forever-spices-up-the-menu-selection/	https://www.indiemag.fr/news/super-meat-boy-forever-runner-annonce-date-sortie-2019	https://store.steampowered.com/app/581660/Super_Meat_Boy_Forever/	Action / plates-formes / violent / Hack and Slash / guerre	no	2019	
1	The Surge 2 †	Xbox One, PS4, PC	Focus Home Interactive	Deck13 Interactive	Multi (personnalisation)	"Qui est donc ce mystérieux héros vu de dos ? Eh bien c'est le vôtre, créé de toutes pièces (sexe, apparence et petites décorations) en début de partie."	Gamekult	https://www.gamekult.com/jeux/the-surge-2-3050877799/test.html	https://wccftech.com/the-surge-2-inteview-e3-2018/	http://jstationx.com/2018/02/19/the-surge-2-female-protagonist-character-creation/	action / rpg / futuriste / science-fiction	unknown	2019	
0 (remake)	Tales of Vesperia: Definitive Edition	PS4, Xbox One, Switch	Bandai Namco Entertainment	Namco Tales Studio	Multi (choix avec héros masculin)	"Avec en plus deux nouveaux personnages jouables qui rejoignent l’équipe ! Patty Fleur, une jeune pirate joyeuse et solide en quête d’un trésor et d’aventure... Et de ses souvenirs perdus. Flynn Scifo, meilleur ami de Yuri et Chevalier Impérial, qui les rejoint pour le reste de leur voyage !"	Site officiel de Bandai Namco Entertainment 	https://fr.bandainamcoent.eu/tales-of/tales-of-vesperia-definitive-edition	https://www.melty.fr/tales-of-vesperia-definitive-edition-un-classique-remis-au-gout-du-jour-notre-test-a669294.html	https://gamergen.com/actualites/tgs-2018-tales-of-vesperia-definitive-edition-7-minutes-gameplay-anglais-patty-fleur-apercu-version-switch-295828-1	rpg / aventure / action / fantasy / narratif	yes	11/01/2019	2018
1	Team Sonic Racing †	Xbox One, PS4, Nintendo Switch, PC	Sega	Sumo Digital	n/a	Certains personnages peuvent être associés au féminin, d'autres au masculin.	Sonic Retro	https://info.sonicretro.org/Team_Sonic_Racing	https://store.steampowered.com/app/785260/Team_Sonic_Racing/	https://nintendo.fandom.com/wiki/Team_Sonic_Racing	course / kart / coopératif / action	yes	21/05/2019	
1	Tetris Effect †	PS4, PSVR	Enhance Games	Monstars, Resonair	N/a	"Tetris Effect est un jeu de type puzzle qui propose une nouvelle version de la célèbre création d'Alexey Pajitnov."	Jeuxvideos.com	http://www.jeuxvideo.com/jeux/ps4/jeu-857428/	https://www.tetriseffect.game/	https://www.gamekult.com/jeux/tetris-effect-3050878733/test.html	puzzle	no	09/11/2018	
1	Total War: Three Kingdoms	PC	Sega	Creative Assembly	Multi (choix)	Sur les 12 personnages, une femme est disponible.	VGR	https://www.vgr.com/total-war-three-kingdoms-heroes-start/	https://www.pcgamer.com/meet-zheng-jiang-total-war-three-kingdoms-bandit-queen/	http://www.gameblog.fr/news/81889-total-war-three-kingdoms-le-chef-de-guerre-tyrannique-dong-z	stratégie / tactique / tour par tour / histoire / guerre / action / fantasy	yes	23/05/2019	
0 (2017)	Transference	PS4, Xbox One, PC	Ubisoft	Ubisoft, SpectreVision, Ubisoft Montréal	Gender-ambiguous	"In order to make Transference a unique experience, Raymond and his family are all non-playable characters. Instead, gamers will essentially play as themselves."	Syfy	https://www.syfy.com/syfywire/fantastic-fest-ubisoft-and-spectrevision-give-an-in-depth-look-at-their-vr-collaboration	https://www.ubisoft.com/en-us/game/transference/	https://www.realite-virtuelle.com/transference-vr-test	action / aventure /  Escape Room / Horreur	no	13/09/2018	
1	Trials Rising	PS4, Xbox One, Switch, PC	Ubisoft	RedLynx	Multi (choix + personnalisation)	"You can’t start this without sending in your application, which is the equivalent of a super simple character creator that only allows you to select your characters gender, voice, and skin color"	Geek Culture Podcast	https://www.geekculturepodcast.com/2019/02/25/trials-rising-review/	https://www.youtube.com/watch?v=bYg7DSDXLbU	https://store.steampowered.com/app/641080/Trials_Rising/	sport / course / moto	yes	26/02/2019	
1	Trover Saves the Universe	PS4 VR	Squanch Games	Squanch Games	M	Le personnage est associé à une voix masculine, et d'apparence masculine. 	IGN	https://fr.ign.com/trover-saves-the-universe-ps4/40653/news/trover-saves-the-universe-pas-de-crossover-avec-rick-morty	https://www.gamekult.com/actualite/trover-saves-the-universe-une-dose-d-absurde-sur-ps4-et-ps-vr-3050806505.html	https://www.gamespot.com/videos/trover-saves-the-universe-e3-2018-trailer-sony-pre/2300-6444505/	action / aventure / plate-formes	no	2019	2018
0 (2017)	Tunic	PC, Xbox One	Finji	Andrew Shouldice	N/a	"TUNIC is an action adventure about a tiny fox in a big world. Explore the wilderness, discover spooky ruins, and fight terrible creatures from long ago."	Steam	https://store.steampowered.com/app/553420/TUNIC/	https://www.jeuxactu.com/tunic-tout-ce-qu-il-faut-savoir-sur-le-jeu-114208.htm	https://gamergen.com/actualites/tunic-zelda-like-adorable-renard-montre-longue-video-gameplay-296563-1	action / aventure / Mignon / Isométrique / Mystère / Familial / Violence /Guerre	no	2019	
