to_keep	game	platforms	editor	developer	gender	Source explication	Source nom	Source lien	Autre source	Autre source	type	Multijoueur	Date de sortie	Annoncé en
 														
1	Adventure Time: Pirates of the Enchiridion	Nintendo Switch, PS4, Xbox One, PC	Outright Games	Climax Studios	Multi	"Explore the Land of Ooo freely, discover secrets and collect loot with playable fan-favourite characters, Finn, Jake, BMO and Marceline." 	Outright Games	https://www.outrightgames.com/adventure-time-pirates-of-the-enchiridion			aventure / cartoon		17/07/2018	
1	Afterparty	Xbox One, PC, PS4	Night School Studio	Night School Studio	Multi	"In AFTERPARTY, you are Milo and Lola, recently deceased best buds who suddenly find themselves staring down an eternity in Hell. But there’s a loophole: outdrink Satan and he’ll grant you re-entry to Earth." 	Night School Studio	http://nightschoolstudio.com/afterparty			aventure		2019	
0 (2017)	Anthem †	PC, Xbox One, PS4	Electronic Arts	BioWare	Multi	"Anthem’s characters are voiced, and you’ll get the choice of a male or female character at the beginning of the game."	PCGamesN	https://www.pcgamesn.com/anthem/anthem-voice-actor	https://www.youtube.com/watch?v=PDQN2ww79Ak	https://www.youtube.com/watch?v=73sBiTAPwSA	Action / rpg	yes	22/02/2019	
0 (2015)	Ashen (personnalisation)	PC, Xbox One	A44	A44	Multi	Personnalisation très poussée du personnage	ASHEN - Character Creation / Cutstomization - Male and Female (Youtube)	https://www.youtube.com/watch?v=9jhsSBEhe18	https://www.youtube.com/watch?v=9w-UiWs8BjM	https://twitter.com/A44games/status/1046528247335346176	action / rpg / Aventure / troisième personne / monde ouvert	yes	07/12/2018	2015
0 (2017)	A Plague Tale: Innocence	Xbox One, PS4, PC	Focus Home Interactive	Asobo Studio	F (personnage principal)	"Coming to PC, PlayStation 4, and Xbox One in 2019, “A Plague Tale: Innocence” is an action-adventure game set in 14th century France, a dark time for protagonists Amicia and her little brother Hugo. They lost their parents to the ruthless Inquisition, forcing them to survive on their own. To top it off, five-year-old Hugo is suffering from a strange illness, and ravenous rodents are spreading throughout the country, eager to devour anything that’s in their way.  As the teenage Amicia, you can’t fight or destroy them. You either avoid the rats altogether or redirect their hunger elsewhere. "	Variety.com	https://variety.com/2018/gaming/features/a-plague-tale-innocence-interview-1202850698/	https://www.jeuxactu.com/a-plague-tale-innocence-une-nouvelle-video-remplie-de-rats-117103.htm	https://www.jeuxactu.com/a-plague-tale-innocence-voici-le-story-trailer-avec-les-voix-anglaises-117379.htm	Action / aventure / Infiltration	no	14/05/2019	
1	Assassin's Creed Odyssey †	PC, Xbox One, PS4	Ubisoft	Ubisoft	Multi	"In Assassin’s Creed Odyssey, you can choose to play either Alexios (a man) or Kassandra (a woman), two siblings separated from their Spartan parents during childhood."	Polygon.com	https://www.polygon.com/2018/10/9/17956140/assassins-creed-odyssey-kassandra-or-alexios			Action / aventure / Infiltration / RPG / Historique		05/10/2018	
1	Assetto Corsa Competizione †	PC	505 Games	Kunos Simulazioni	gender-ambiguous	Visage du personnage non visible	Démo Youtube	https://www.youtube.com/watch?v=1PumKE95Zu0			Racing simulation	yes	12/09/2018	
1	Astro Bot†	PS4 VR	SIE Japan Studio	Sony Interactive Entertainment	N/A	"Dans l'espace, des petits robots voguent sur un vaisseau coiffé d'un casque PSVR. Un alien un peu belliqueux et tout ce qu'il y a de plus gluant attaque la flotte, dispersant tous ses occupants à travers l'espace, détruisant au passage 5 parties du vaisseau."	Jeuxvideos.com	http://www.jeuxvideo.com/test/933144/astro-bot-rescue-mission-une-pepite-de-la-plate-forme-en-realite-virtuelle.htm			Action / Plateforme	no	02/10/2018	
1	The Awesome Adventures of Captain Spirit	PS4, Xbox One, PC	Square Enix	DONTNOD Entertainment	M	"Vous avez déjà rêvé d'être un super-héros ? Voici Chris, un garçon de 9 ans plein d'imagination qui part dans des aventures fantastiques sous les traits de son alter-ego, l'extraordinaire Captain Spirit !"	Steam	https://store.steampowered.com/app/845070/The_Awesome_Adventures_of_Captain_Spirit/			aventure	no	25/06/2018	
1	Battlefield V	PS4, Xbox One, PC	Electronic Arts	DICE	Multi	"La semaine dernière a eu lieu le reveal de Battlefield V mais un des éléments présentés à fait grincer les dents de plus d'un. En effet, la possibilité d'incarner des personnages féminins a provoqué quelques réactions. Malgré les fanfaronnades de DICE, le studio reste fidèle à lui-même et reste sur sa position. Les développeurs ne comptent pas se laisser impacter par une minorité."	GameReactor	https://www.gamereactor.fr/news/667643/Battlefield+V+Les+choix+des+joueurs+et+les+personnages+feminins+resteront/			FPS	yes	09/11/2018	
1	Battletoads	Xbox One, PC	Microsoft	DLaLa Studios	N/A	"The toads are back in this revival of developer Rare's unusual brawling series, featuring Zitz, Rash, and Pimple as three toads turned totally into bad dudes."					Action	yes	2019	
0 (no info)	Babylon's Fall	PS4, PC	Square Enix	PlatinumGames	/	/	/	/	/		Fantasy	/	2019	
1	Beyond Good and Evil 2	TBA	Ubisoft	Ubisoft	Multi	Will our race or human/hybrid status change our interactions with NPCs? (ketouki, Twitter) Yes, we want the World around you to react to your visual identity. Depending on whether you play as a human or as a hybrid Space Pirate Captain, you will not be welcomed the same way in different places.	site officiel	https://beyondgoodandevil.ubisoft.com/en-us/news/ignt13837-Space-Monkey-Report-#4:-VOD-&-questions-answered			Action / Aventure	yes	/	
1	Beat Saber †	PC, PS4 VR	Hyperbolic Magnetism	Hyperbolic Magnetism	gender-ambiguous	"Beat Saber is a VR rhythm game where your goal is to slash the beats which perfectly fit into precisely handcrafted music."	Trailer sur Steam	https://store.steampowered.com/app/620980/Beat_Saber/				yes	20/11/2018	
0 (2013)	Below	PC, Xbox One	Capybara Games	Capybara Games	gender-ambiguous	Personnage minuscule, silhouette et héros successifs	IGN (screens)	https://www.ign.com/articles/2018/12/20/below-review	http://www.gameblog.fr/tests/3289-below-xb1-pc	https://www.gamekult.com/jeux/below-3050247063/test.html	Action / aventure / Roguelike	yes	14/12/2018	E3 2013
0 (2017 + nouveau support)	Black Desert Online	PC, Xbox One	Kakao Games	Pearl Abyss	Multi (choix)	Le joueur peut incarner des personnages de différents genres, et les personnaliser.	Black Desert	https://www.blackdesertonline.com/	https://www.gamekult.com/jeux/black-desert-online-3050063766.html	https://www.youtube.com/watch?v=8eVhqGh0MqE	MMORPG / action / RPG	yes	2015 (en Corée)	
1	Blood and Truth †	PS4 VR	Sony Interactive Entertainment	SIE London Studio	M	"My name is Ryan Marx"	Blood and Truth Official Paris Games Week 2017 Announce Trailer	https://www.ign.com/videos/2017/10/30/blood-and-truth-official-paris-games-week-2017-announce-trailer	https://www.millenium.org/news/327633.html	http://www.jeuxvideo.com/news/1030430/blood-truth-le-blockbuster-du-ps-vr-est-passe-gold.htm	Tir	yes	31/12/2019	Paris Games Week 2017
1	Bomber Crew	PC, Xbox One, PS4, Switch	Curve Digital	Runner Duck	Multi	https://cdn3.dualshockers.com/wp-content/uploads/2018/07/BomberCrew-Recruit.jpg	DualShockers	https://www.dualshockers.com/bomber-crew-review-ps4-xbox-one-switch/			simulation / stratégie	yes	19/10/2017	
0 (2017)	Call of Cthulhu	PS4, Xbox One, PC	Cyanide Studio	Focus Home Interactive	M	Le joueur incarne Edward Pierce.	Site officiel de Cthulhu	http://www.callofcthulhu-game.com/	https://www.lesnumeriques.com/jeux-video/call-of-cthulhu-p49471/test.html	http://www.gameblog.fr/tests/3208-call-of-cthulhu-pc	Survie / horreur / RPG / aventure / narration / détective / FPS 	no	30/10/2018	
1	Call of Duty: Black Ops 4 †	PC, PS4, Xbox One	Activision	Treyarch	Multi	"Unis par leur loyauté envers un aventurier disparu alors qu'il était sur la piste d'un mystérieux secret, notre équipe, Scarlett, Bruno, Diego et Shaw, se retrouve plongée dans une odyssée terrifiante."	Call of Duty	https://www.callofduty.com/fr/blackops4/zombies	https://callofduty.fandom.com/wiki/Scarlett_Rhodes	https://www.pcgamesn.com/call-of-duty-black-ops-4/call-of-duty-black-ops-4-specialists-abilities	Tir	yes	12/10/2018	
0 (no info)	Call of Guardians †	iOS, Android	GungHo Online Entertainment America	Signal Studios					https://www.youtube.com/watch?v=EfisgP6cZ7k	https://www.callofguardians.com			unknown	2018
0	Catherine: Full Body	PS4, PS Vita	Atlus, Deep Silver	Atlus	M	/	Les Croissants	Chronique "Catherine et ses plans cubes", Benjamin Benoit			Action-Aventure	1	14/02/2019	
1	Children of Morta	PS4, Xbox One, PC	11 bit studios	 Dead Mage	 Multi	« The heroes in this game are all members of a family, the Bergsons, each with their unique abilities. While adventuring with any of them in the various environments in the lands of Morta, you will witness their emotions and struggles to help one another in order to return peace to their land. All the family members are playable characters. »	ChIldren of Morta Wiki	http://www.childrenofmorta.wikia.com/wiki/Characters			action / aventure / rpg	yes	2019	2014
1	Command and Conquer: Rivals	Android, IOS	Electronic Arts	EA Redwood Studios	Multi (choix)	Il est possible de choisir une commande ou un commandant.	Site officiel d'EA	https://www.ea.com/fr-fr/games/command-and-conquer/command-and-conquer-rivals/tips-and-tricks	https://cnc.fandom.com/wiki/Jade_Liang	https://play.google.com/store/apps/details?id=com.ea.gp.candcwarzones&hl=fr	stratégie / rts	yes	04/12/2018	2018
0 (2016)	Conquerors Blade	PC, PS4	My.com, Booming Games	Booming Games	Multi (choix + personnalisation)	Le joueur peut choisir le genre de son personnage et personnaliser celui-ci.	Conquerors Blade (site officiel)	https://cb.my.com/en/news/48-pre-ordering-conqueror-s-blade	https://www.youtube.com/watch?v=zT1qZFyGVbs	https://www.youtube.com/watch?v=Lf3KEHLOpS4	Action / Stratégie / RPG / Monde ouvert / MMORPG / Médiéval	yes	2019	
1	Control	PS4, Xbox One, PC	505 Games	Remedy Entertainment	F	"Control nous placera dans la peau de Jesse Faden, jeune femme dotée de pouvoirs télékinésiques qui tentera de découvrir l'origine de ces derniers, alors qu’une menace surnaturelle envahit le Bureau Fédéral du Contrôle, une organisation gouvernementale secrète. "	Jeuxvideos.com	http://www.jeuxvideo.com/news/1013318/control-remedy-presente-les-pouvoirs-de-jesse-faden-l-heroine.htm	https://gamewave.fr/control/control-donne-plus-d-informations-sur-jesse-faden/	https://fr.ign.com/control-ps4/45587/news/control-le-nouveau-jeu-de-remedy-sortira-cet-ete	action / aventure / troisième personne / TPS / science-fiction / supernaturel	no	2019	
0 (2017)	Crackdown 3	Xbox One, PC	Microsoft Studios	Reagent Games	Multi	Plusieurs personnages féminins sont proposés.	Crackdown 3: Single-Player Gameplay Footage & Details (4K) - IGN First (Youtube)	https://www.youtube.com/watch?time_continue=131&v=4JXB9hioK1M	https://jstationx.com/2018/12/21/crackdown-3-female-protagonist-options/	https://www.youtube.com/watch?v=Z1SINFVPKNw	action / aventure / Tir en vue objective	yes	15/02/2019	2014
1	Creed: Rise to Glory †	PS4 VR	Survios	Survios	M	"CREED: Rise to Glory™ puts you in the gloves of underdog Adonis Creed and challenges you to rise through the ranks to become a champion to be reckoned with. Train with the legendary Rocky Balboa, feel yourself become stronger, and go toe-to-toe with opponents under the spotlights of packed championship rings."	Survios	https://survios.com/creed/			action / fitness / sport		25/09/2018	
0	Crash Bandicoot N. Sane Trilogy †	PS4, Nintendo Switch, Xbox One, PC												
0 (DLC)	Cuphead: The Delicious Last Course (DLC)	PC, Xbox One	Studio MDHR	Studio MDHR	Multi	"At the centerpiece of this feast is the premiere of Ms. Chalice, a new playable character with a brand new twist on the classic Cuphead move set."	Trailer officiel	http://studiomdhr.com/the-delicious-last-course-cuphead-dlc-announcement/			Platerforme	1	2019	
1	Cyberpunk 2077	PC, Xbox One, PS4	CD Projekt	CD Project Red	Multi	"One of the details revealed in the Eurogamer interview we mentioned earlier is that the player will play as a set character in Cyberpunk 2077. The character is called V, and has a set identity and over-arching story. Players can customize them though, and can choose whether to play as a female or male V."	US Gamer	https://www.usgamer.net/articles/28-08-2018-cyberpunk-2077-character-creation-and-classes			Action-RPG	yes	/	
1	Daemon X Machina	Nintendo Switch	Nintendo	Marvelous Inc.	Multi	"You can play either a female avatar or a male avatar"	Live E3 Nintendo	https://www.youtube.com/watch?v=DJdWDuYRl50			Action	1	2019	
0 (2016)	Days Gone	PS4	SIEE	Bend Studio	M	"Set in the beautiful, volcanic scarred high-desert of the Pacific Northwest, Days Gone is an open-world action-adventure game where you play as Deacon St. John, a Drifter and bounty hunter who would rather risk the dangers of the broken road than live in one of the “safe” wilderness encampments. "	Bend Studio	https://bendstudio.com/games/days-gone/	https://gamerant.com/days-gone-protagonist-no-custom-appearance/	https://daysgone.fandom.com/wiki/Days_Gone_Wiki	Action / aventure / survival horror	no	26/04/2019	
0 (2016)	Death Stranding	PS4	Sony Interactive Entertainment	Kojima Productions	M	Le joueur incarne Sam Bridges, un homme "qui brave un monde mortel et mystérieux où la mort se tapit dans tous les recoins. Transportez les vestiges de l'avenir et embarquez dans un voyage pour reconstruire un monde brisé, petit à petit".	Death Stranding - E3 2018 4K Trailer | PS4	https://www.youtube.com/watch?v=rP3UngLFou4	https://www.senscritique.com/jeuvideo/Death_Stranding/21588200	http://jstationx.com/2018/06/12/death-stranding-female-characters-trailer-e3-2018/	Action / exploration	yes	2019	2016
1	Dead or Alive 6	PS4, Xbox One, PC	Koei	Team Ninja	Multi	"on peut commencer par jeter un œil à l’effectif de personnages jouables qui devrait compter un total de 26 noms. Parmi eux, deux combattants totalement inédits. Nico, une scientifique surdouée de 18 ans, pratique le pencak silat et peut faire passer de l’énergie électrique à travers les anneaux qu’elle porte aux doigts pour des attaques plus dévastatrices. Quant à Diego, son style de combat issu de la rue se veut bien plus brute de décoffrage, tout comme son tempérament de feu. "	jeuxactu.com	https://www.jeuxactu.com/dead-or-alive-6-notre-avis-au-gout-de-cle-de-bras-et-de-nuque-brisee-117048.htm	https://teamninja-studio.com/doa6/uk/characters.html		combat	yes	01/03/2019	
1	Dead Cells	PC, Xbox One, PS4, Switch	Motion-Twin	Motion-Twin	M	Le joueur incarne un chevalier.	Dead Cells - Launch Trailer | PS4	https://www.youtube.com/watch?v=RvGaSPTcTxc	https://www.lemonde.fr/pixels/article/2018/08/07/dead-cells-le-jeu-d-action-sans-pitie-qui-prend-plaisir-a-nous-faire-du-mal_5340020_4408996.html		action / aventure / plate-formes / Rogue-like /Metroidvania		07/08/2018	
1	Defender's Quest: Valley of the Forgotten DX	Nintendo Switch	Level Up Labs	Level Up Labs	Multi (perso principal féminin)	"Empezaremos hablando de la historia; el juego nos traslada al reino de Ash, el cual se encuentra invadido y destrozado por una plaga de muerte. Nosotros encarnaremos a Azra, aunque a medida que vayamos avanzando en la historia, iremos estando acompañados de otros personajes como Slak, un joven Berseker (al igual que Azra se darán cuenta de que son inmuten a la plaga). "	IGN Espagne (critique)	https://es.ign.com/defenders-quest-ps4/129923/review/defenders-quest-valley-of-the-forgotten-analisis-para-ps4			RPG / Stratégie / Tactique	no	20/02/2018	Adaption d'un jeu PC de 2012
0 (extension/dlc)	Destiny 2: Forsaken † (DLC)	Xbox One, PS4, PC												
1	Devil May Cry 5	PS4, Xbox One	Capcom	Capcom	M (à vérifier à la sortie)	"Avec Devil May Cry 5, ce ne sont pas deux mais trois personnages jouables qui sont proposés durant ce nouveau périple : Nero, Dante et V, un petit nouveau sacrément énigmatique sur lequel nous reviendront plus tard."	Jeuxactu.com	https://www.jeuxactu.com/devil-may-cry-5-on-a-joue-avec-nero-dante-et-v-le-meilleur-episode-117089.htm	http://www.devilmaycry5.com/fr/character/	https://steamcommunity.com/app/601150	Action / Beat'em All / Plate-Forme		08/03/2019	
1	Déraciné	PS4 VR	FromSoftware	Sony Computer Entertainment	gender-ambiguous	"Déraciné nous place dans la peau d’un simple esprit, capable de reprendre le temps qu’il reste à vivre aux humains, tout comme remonter dans le temps pour changer le passé. Vous, en tant que bon esprit, vous suivrez les périples des habitants d’un internat."	Actu Gaming	https://www.actugaming.net/test-deracine-le-premier-jeu-vr-de-from-software-bourre-de-lacunes-175942/	https://www.youtube.com/watch?v=BO-IjfgPyNY	https://www.playstation.com/fr-fr/games/deracine-ps4/	Aventure / poétique / solitude	no	06/11/2018	
1	Divinity: Original Sin 2 †	PC, PS4, Xbox One	Bandai Namco Games	Larian Studios	Multi (choix + personnalisation)	Il est possible de personnaliser son personnage et d'avoir un personnage féminin ou masculin.	Divinity: Original Sin 2 / Female Character Creation (Youtube)	https://www.youtube.com/watch?v=jA6gGUCpYBc	https://www.youtube.com/watch?v=khH5wjqlZ2E	https://www.youtube.com/watch?v=RIz43NiWgGI	RPG / Tour par tour / Coopération / Fantasy / Monde ouvert / Aventure / stratégie / tactique 	yes	14/09/2017	
1	Dreams	PS4	Media Molecule	Sony Interactive Entertainment	Multi (personnalisation)	Le joueur modele lui meme son personnage.	Dreams How to Create & Edit Characters/ Puppets (Youtube)	https://www.youtube.com/watch?v=bBjzUWOWXs4	https://www.youtube.com/watch?v=WNAsEDXqLbw	http://www.jeuxvideo.com/videos/1006204/dreams-une-video-pour-cloturer-la-beta-du-jeu.htm	sandbox	no	2019	
1	Tom Clancy's The Division 2 †	PC, PS4, Xbox One	Ubisoft	Massive Entertainment, Ubisoft Reflections, PLUS	Multi (choix)	"You start the beta in a relatively simple menu and create a new game in which you can choose between a pre-made male character or a pre-made female character to play with."	TechAcute	https://techacute.com/checking-out-the-division-2-in-private-beta/	https://www.youtube.com/watch?v=YgDa0tlHjQE	https://www.youtube.com/watch?v=V-jCX-rm_dI	action / rpg / fps / mmo / post-apocalyptique	yes	15/03/2019	
0 (no info)	Doom Eternal	PC, PS4, Xbox One	Bethesda Softworks	id Software							fps / tir	yes	2019	
0 (2017)	Dragon Ball FighterZ †	PC, PS4, Xbox One, Switch	Bandai Namco Entertainment	Arc System Works	Multi (choix)	Des personnages masculins et feminins sont disponibles.	FEMALE ZAMASU GAMEPLAY - Dragon Ball FighterZ Female Zamasu & ALL DRAMATIC FINISHES GAMEPLAY (Youtube-	https://www.youtube.com/watch?v=fHZrn66iVME	https://dragonball.fandom.com/wiki/Dragon_Ball_FighterZ	https://www.youtube.com/watch?v=XdAs0qzuC0g	combat / action / arcade / narratif / beat 'em up	yes	26/01/2018	
1	Dragon Quest XI †	PS4, Switch, PC	Square Enix	Square Enix, Toylogic, ORCA	Multi (choix)	Plusieurs personnages de differents genres sont disponibles.	Site officiel de Dragon Quest	https://dragonquest.square-enix-games.com/xi/en-us/characters/	https://www.youtube.com/watch?v=hwGo2omGbtc	https://www.engadget.com/2018/08/28/dragon-quest-xi-review/?guccounter=1&guce_referrer_us=aHR0cHM6Ly93d3cuZ29vZ2xlLmNvbS8&guce_referrer_cs=AgoBxsAarphN3p0Zx4bZxw	rpg/ combat / tour par tour / fantasy / narratif / aventure / action /horreur	no	29/07/2017	2015
0 (no info)	Dying Light 2	PS4, Xbox One, PC	Techland	Techland	probablement multi						action / rpg / fps / survie / horreur	no	2019	2018
0	The Elder Scrolls VI	TBA	Bethesda	Bethesda	/	/	Bethesda	https://www.youtube.com/watch?v=OkFdqqyI8y4			RPG	/	/	
0	The Elder Scrolls Blades †	iOS, TBA	Bethesda Softworks	Bethesda Game Studios	F (à revérifier)	"Given that Bethesda’s RPGs have typically allowed you to make a female protagonist, the ability to choose your character’s gender is also expected."	JSX	http://jstationx.com/2018/06/21/the-elder-scrolls-blades-character-customization-features/		https://www.youtube.com/watch?v=6kghicRM7vw	action / rpg	yes	2019	2018
0 (nouveau support ok)	The Elder Scrolls: Legends (coming to console)	PC, iOS, Switch	Bethesda Softworks	Bethesda Softworks, Dire Wolf Digital, Sparkypants Studios, Dire Wolf Digital LLC						https://legends.bethesda.net/			09/03/2017	2015
0 (extension/dlc)	The Elder Scrolls Online: Summerset †	PC, Xbox One, PS4	Bethesda Softworks	Bethesda Softworks					https://legends.bethesda.net/fr/news	http://www.jeuxvideo.com/jeux/jeu-429115/#details	Heroic Fantasy			
1	Fallout 76	PS4, Xbox One, PC	Bethesda	Bethesda	Multi (personnalisation)	"La première étape consiste toujours à créer son personnage, ce qui peut prendre des heures tellement les options sont nombreuses. Couleur des yeux des cheveux, des sourcils, de la barbe, forme de chaque partie du visage et morphologie sont libres, et on peut bien évidemment opter pour un homme ou une femme."	Game Blog	http://www.gameblog.fr/news/78758-fallout-76-un-jeu-de-survie-qui-peine-a-convaincre-on-vous-d	https://www.gamesradar.com/fallout-76-character-creation-customization-advancement/	https://www.rockpapershotgun.com/2018/11/15/fallout-76-character-creation-how-to-make-your-perfect-vault-76-resident-2/	RPG / survie	yes	14/11/2018	
0 (nouveau support ok)	Fallout Shelter	iOS, PC, Xbox One, PS4, Switch									ie			
1	Farming Simulator 19 †	Xbox One, PC, PS4	Focus Home Interactive	GIANTS Software	Multi (choix + personnalisation)	"Homme, femme, couleur de peau, etc. Créez votre fermier à votre image." + captures d'écran	Simulagri	https://www.simulagri.fr/2018/11/test-farming-simulator-19-gameplay-et-maps-des-changements-bienvenus/	https://gamewave.fr/farming-simulator-19/farming-simulator-19-presente-le-nouveau-systeme-de-personnalisation-des-personnages/		Simulation	yes	20/11/2018	
1	Fate Extella Link †	PS4, PC, Switch	Marvelous’ First Studio	Marvelous	Multi (choix)	Il est possible de jouer le personnage d'Attila Larva.	Youtube (trailer)	https://www.youtube.com/watch?v=CzCLqFGdEFA	https://gematsu.com/2018/10/fate-extella-link-for-switch-coming-west-pc-version-announced	http://www.nintendo-difference.com/news47472-fateextella-link--attila-larva-et-de-nouveaux-costumes-chibi-annonces-en-dlc.htm	action	yes	07/06/2018 (Japon sur PS4)	
1	Fear the Wolves	PC, Xbox One, PS4	Focus Home Interactive	Vostok Games	Multi (personnalisation)	"Dans le menu principal on peut choisir le sexe de son personnage ainsi que son apparence, c’est une « nouveauté » de l’EA, comme quoi bien des choses avancent en 1 mois de report… "	No Frag	https://nofrag.com/2018/09/03/117644/	http://www.thegeekgeneration.com/2018/09/we-tried-to-play-fear-the-wolves-but-the-game-wasnt-having-it/	https://level2gamers.com/tag/fear-the-wolves/	FPS / battle royale / post-apocalyptique / survie	yes	31/12/2019	
1	FIFA 19 †	Xbox One, PS4, PC, Nintendo Switch	Electronic Arts	Electronic Arts	Multi (choix	"Play as Women's National Teams for the first time in the FIFA franchise. Choose from 12 teams and compete* in Match Day, an Offline Tournament, and Online Friendly Matches."	Fifa (site officiel)	https://www.easports.com/fifa/women	https://www.youtube.com/watch?v=VqIvBZ4Jqjw	https://www.theodysseyonline.com/female-managers-in-fifa-games	sport	yes	28/09/2018	
1	Fire Emblem: Three Houses	Nintendo Switch	Nintendo	Nintendo / Intelligent Systems	Multi (choix)	"In the aforementioned Direct in February 2019, we finally got some solid details about the story of Fire Emblem Three Houses. You'll be able to choose between a male of female avatar, and you'll be taking on the role of a young soldier working under their father, Geralt (no, not that Geralt)."	US gamer	https://www.usgamer.net/articles/14-02-2019-fire-emblem-switch-release-date-characters	https://fr.ign.com/fire-emblem-for-nintendo-switch-nintendo-switch/45167/news/fire-emblem-three-houses-une-date-de-sortie-et-du-gameplay	https://www.theouterhaven.net/2018/11/everything-we-know-about-fire-emblem-three-houses/	Jeu de rôle tactique tour par tour	no	26/9/2019	
1	Firewall Zero Hour	PS4 VR	Sony Interactive Entertainment	First Contact Entertainment Inc.	Multi (choix + personnalisation)	Plusieurs femmes sont jouables parmi les 12 personnages possibles.	Youtube (trailer)	https://www.youtube.com/watch?v=hZiy_2AOPDE	https://variety.com/2018/gaming/features/firewall-zero-hour-preview-1202819618/	http://www.jeuxvideo.com/screenshots/762519-2534119-0	Jeu de tir à la première personne	yes	28/08/2018	
0 (extension/dlc)	Final Fantasy XIV: Stormblood †	PC	Square Enix	Square Enix									20/06/2017	
0 (2015)	For Honor †	PC, PS4, Xbox One	À ubisoft	Ubisoft Montréal	Multi (choix)	Il est possible de changer le genre du personnage joué.	Youtube (For Honor - How to Change Gender/Skin/Race (Tutorial))	https://www.youtube.com/watch?v=e0q41-rRco8	https://www.youtube.com/watch?v=2NxQZEnSnXQ	http://jstationx.com/2016/08/18/for-honor-female-characters-black-vikings/	action / combat	yes	14/02/2017	
