to_keep	game	platforms	editor	developer	gender	Source explication	Source nom	Source lien	Autre source	Autre source	type	Multijoueur	Date de sortie	Annoncé en
1	Twin Mirror	PC, PS4, Xbox One	Bandai Namco Entertainment	Dontnod Entertainment	M	"Samuel, un homme de 33 ans qui se remet d'une rupture amoureuse retourne dans sa ville natale de Basswood, West Virginia, pour assister aux funérailles de son meilleur ami. Déprimé et amer, il se sent à la fois abattu et sans repères..."	Site officiel de Bandai Namco Entertainment	https://fr.bandainamcoent.eu/twin-mirror/twin-mirror	https://www.youtube.com/watch?v=TS5joUjdxvk	https://www.gamekult.com/jeux/twin-mirror-3050878747.html	aventure / narratif / violence / guerre	no	2019	
1	Unravel 2	PS4, Xbox One, and PC	Electronic Arts	ColdWood Interactive	N/a	Le joueur incarne un petit personnage de laine. 	 Unravel : La naissance de Yarny (Youtube)	https://www.youtube.com/watch?v=hzbgpG3tE4g	https://www.gamesradar.com/unravel-2-is-a-co-op-wooly-adventure-and-omg-you-can-make-your-own-yarny/	https://www.microsoft.com/fr-fr/p/unravel-two/c4vklmg1hlzw?activetab=pivot:overviewtab	plates-formes / aventure / co-op / enigme	yes	09/06/2018	
1	Vacation Simulator †	PS4 VR	Owlchemy Labs	Owlchemy Labs	Multi (choix + personnalisation)	"For this, we looked at the most common haircuts across age, gender, texture, and major cultural groups and tried to represent 2-4 styles from each group."	OwlChemy Labs	https://owlchemylabs.com/vacation-simulator-avatar-customizer-system/	https://www.shacknews.com/article/108520/vacation-simulator-adds-vr-avatar-customizer-feature	https://gamesavvy.net/vacation-simulator-announced/	action / aventure / simulation	no	09/04/2019	
1	Valkyria Chronicles 4 †	Nintendo Switch, PS4, Xbox One, PC	Sega	Sega CS3	Multi (choix)	Il est possible de jouer Claude Wallace (homme), Riley (femme)...	Site officiel de Valkyria	http://valkyria.sega.com/character.php	https://www.thegamer.com/valkyria-chronicles-4-unlock-secret-soldiers-guide-explained/	https://valkyria.fandom.com/wiki/Category:Valkyria_Chronicles_4_characters	action / stratégie / tour par tour / aventure / rpg	no	21/03/2018 (au Japon)	
0 (2017)	Vampyr †	PS4, Xbox One, PC	Focus Home Interactive	Dontnod Entertainment	M	"Vous êtes Jonathan Reid, l'un des plus grands chirurgiens de votre époque, de retour en Angleterre après des années à servir dans les tranchées françaises. "	Gamekult	https://www.gamekult.com/jeux/vampyr-3050394023/test.html	http://www.jeuxvideo.com/jeux/jeu-423727/#details	https://www.jeuxactu.com/vampyr-une-video-bien-sombre-qui-raconte-l-histoire-du-jeu-113360.htm	action / narratif / rpg / histoire	no	05/06/2018	
1	V-Rally 4 †	Nintendo Switch, PS4, Xbox One, PC	Bigben Interactive	Kylotonn	gender-ambiguous	Le joueur choisit sa voiture mais on ne voit jamais le personnage qui conduit.	V-RALLY 4 (FR) - Découvrons le jeu ensemble! (Youtube)	https://www.youtube.com/watch?v=ROlmKvYzYyM	https://www.youtube.com/watch?v=6vlyyO8XPos	https://store.steampowered.com/app/658700/VRally_4/	sport / course / simulation	yes	06/09/2018	
1	Warhammer 2: Vermintide	PS4, Xbox One, PC	Fatshark	Fatshark	Multi (choix)	Cinq personnages sont jouables, certains masculins d'autres féminins.	Site officiel de Warhammer 2: Vermintide	https://www.vermintide.com/	https://vermintide2.gamepedia.com/Heroes_%26_Careers	https://store.steampowered.com/app/552500/Warhammer_Vermintide_2/	action / première personne / gore / fantasy / RPG / Survie / FPS /Aventure	yes	08/03/2018	
0 (2016)	Warhammer 40,000: Inquisitor-Martyr	PC, PS4, Xbox One	NeocoreGames	NeocoreGames	Multi (choix + personnalisation)	"The Assassin, the only female option, has various states of high speed and stealth, depending upon which background the players choose."	PlayStation lifestyle	https://www.playstationlifestyle.net/2018/08/23/warhammer-40000-inquisitor-martyr-ps4-review/	http://www.graal.fr/2018/07/20/test-warhammer-40000-inquisitor-martyr-version-pour-steam/	https://www.youtube.com/watch?v=8ddKl6p9i9E	action / rpg  / hack’n’slash 	yes	05/06/2018	
0 (2017)	Wargroove	PC, PS4, Xbox One, Switch	Chucklefish	Chucklefish	Multi (choix)	Dans chaque faction, des commandants masculins et féminins sont disponibles.	Wargroove wiki	https://wargroovewiki.com/Commanders	http://royalnintendoswitch.over-blog.com/2018/06/wargroove-presente-ses-trois-derniers-commandants.html	https://store.steampowered.com/app/607050/Wargroove/	tactique / tour par tour / stratégie / stratégie / fantasy	yes	01/02/2019	
0 (no info)	Waking	Xbox One, PC		Jason Oda						http://wakinggame.com/	émotion / action / aventure			
0 (2016)	We Happy Few	Xbox, PS4, PC	Gearbox Publishing	Compulsion Games	Multi (choix)	Parmi les trois personnages disponibles, un est féminin.	Site officiel de We Happy Few	http://www.wehappyfewgame.com/?lang=fr	http://www.jeuxvideo.com/test/898506/we-happy-few-l-aventure-stupefiante-qui-cache-sa-joie.htm	https://we-happy-few.fandom.com/wiki/Sally_Boyle	Survie / Monde ouvert / Horreur psychologique / Dystopique / 1re personne / Horreur / Aventure / Action / Infiltration / Exploration / Rogue-like	no	10/08/2018	2015
0 (no info)	The Wind Road	PC, Xbox One	BlackCGGame	BlackCGGame	Multi (choix)						action / aventure / rpg			
1	Wolfenstein: Cyber Pilot	VR	Bethesda Softworks	Bethesda Softworks	gender-ambiguous	jeu vr, pas de certitude sur le genre du personnage	VR Focus	https://www.vrfocus.com/2018/06/hands-on-with-nazi-slaying-war-machines/	http://www.jeuxvideo.com/jeux/jeu-859913/#details	https://wolfenstein.fandom.com/wiki/The_Hacker	tir à la première personne / action / aventure	yes	Courant 2019	2018
1	Wolfenstein: Youngblood	PC, Xbox One, PS4	MachineGames	Activision	F	"Zlle laisse le choix entre… deux femmes uniquement, les filles du héros habituel.	Le Monde	https://www.lemonde.fr/pixels/article/2018/06/12/au-salon-du-jeu-video-de-l-e3-la-grande-annee-des-femmes_5313536_4408996.html		https://www.jeuxactu.com/wolfenstein-youngblood-pas-de-cartouche-dans-la-version-switch-117890.htm	Plates-formes / tir à la première personne / guerre / infiltration		2019
0 (remake)	Yakuza Kiwami 2 †	PS4, PC								https://www.gamekult.com/jeux/yakuza-kiwami-2-3050876539/test.html			28/08/2018	
0 (nouveau support ok)	Yakuza 0†	PS4, PC	Sega	Ryū ga Gotoku Studio	M	Le joueur incarne "Kazuma Kiryu, un membre de gang accusé d'un meurtre dont il est innocent. De son côté Gorô Majima, responsable d'un cabaret lucratif, est face à un dilemme : tuer quelqu'un et retrouver son rang au sein des yakuzas ou faire fructifier son commerce."	Jeuxvideo.com	http://www.jeuxvideo.com/jeux/playstation-4-ps4/00053983-yakuza-zero-the-place-of-oath.htm#details	https://grettogeek.com/test-pc-yakuza-0/	https://www.gamekult.com/jeux/yakuza-zero-3050325525.html	Action / narratif / Beat them all / monde ouvert / rpg / aventure / humour / comédie / 3e personne	yes	12/03/2015 (Japon)	2014 (fuite)